{"$schema":"https://json-schema.org/draft/2020-12/schema","$id":"https://atis.invalid/schemas/master-recovery-packet.schema.json","type":"object","additionalProperties":false,"required":["schema_version","packet_id","packet_role","repository","non_authorizing_statement","recovery_basis","reading_precedence","required_sources","supplementary_sources","historical_sources","current_state","stale_source_exclusions","known_limitations","authority_not_granted","restore_assertions"],"properties":{
"schema_version":{"const":1},"packet_id":{"const":"ATIS-MASTER-RECOVERY-PACKET-001"},"packet_role":{"const":"RECOVERY_INDEX_ONLY"},"repository":{"const":"KiloAlpha021/automated-trading-bot"},"non_authorizing_statement":{"type":"string","minLength":1},
"recovery_basis":{"type":"object","additionalProperties":false,"required":["commit","tree","ordered_parents","verification_decision","meaning"],"properties":{"commit":{"$ref":"#/$defs/gitId"},"tree":{"$ref":"#/$defs/gitId"},"ordered_parents":{"type":"array","prefixItems":[{"$ref":"#/$defs/gitId"},{"$ref":"#/$defs/gitId"}],"items":false,"minItems":2,"maxItems":2},"verification_decision":{"const":"ATIS_PR23_FINAL_POST_MERGE_VERIFICATION_PASS"},"meaning":{"const":"RECOVERY_BASIS_NOT_PACKET_PUBLICATION_IDENTITY"}}},
"reading_precedence":{"type":"array","prefixItems":[{"const":"RECOVERY_BASIS_AND_INDEX"},{"const":"CURRENT_PROGRAMME_CONTROL"},{"const":"CURRENT_MILESTONE_CLOSURE_AND_PROTECTION"},{"const":"PROTECTED_STAGE3_SPECIFICATION"},{"const":"GOVERNING_BASELINE_SPECIFICATION"},{"const":"SUPPLEMENTARY_TRACEABILITY_AND_EVIDENCE"},{"const":"HISTORICAL_OR_SUPERSEDED_EVIDENCE"}],"items":false,"minItems":7,"maxItems":7,"uniqueItems":true},
"required_sources":{"type":"array","minItems":15,"maxItems":15,"uniqueItems":true,"items":{"$ref":"#/$defs/requiredSource"}},
"supplementary_sources":{"type":"array","minItems":5,"maxItems":5,"uniqueItems":true,"items":{"$ref":"#/$defs/supplementarySource"}},
"historical_sources":{"type":"array","minItems":3,"maxItems":3,"uniqueItems":true,"items":{"$ref":"#/$defs/historicalSource"}},
"current_state":{"$ref":"#/$defs/currentState"},
"stale_source_exclusions":{"type":"array","minItems":11,"maxItems":11,"uniqueItems":true,"items":{"$ref":"#/$defs/exclusion"}},
"known_limitations":{"type":"array","minItems":17,"maxItems":17,"uniqueItems":true,"items":{"enum":["HISTORICAL_UNIVERSE_NOT_CLAIMED_COMPLETE","FOUR_GAPS_RECONCILED_WITH_EXPLICIT_LIMITATIONS","HISTORICAL_RECORDS_PRESERVE_CREATION_TIME_STATE","RESEARCH_DEFINITIONS_AND_ORDER_RECONSTRUCTED_NOT_VERBATIM","PC_EVID_019_AND_025_ASSISTANT_TIMESTAMPS_NOT_RECOVERED","OFFICE_ARTIFACTS_NOT_REHASHED_IN_LATEST_INVENTORY","NO_OFFICE_ARTIFACT_DERIVATION_CHAIN_ASSERTED","ORIGINAL_R39_INDIVIDUAL_SEMANTICS_NOT_RECOVERED","STAGE3_DECISIONS_REMAIN_UNRESOLVED","STAGE3_CORPUS_DIGEST_NOT_ESTABLISHED","STAGE3_IMPLEMENTATION_PARTIAL_BOUNDED_AND_STAGE3_ASSURANCE_NOT_COMPLETE","NO_PROVIDER_SELECTED","NO_LATER_STAGE_TRADING_OR_FINANCIAL_AUTHORITY","PR23_ARTIFACT_DIGEST_SERVER_REPORTED_ONLY","POST_MERGE_RUN_IS_EXTERNAL_VERIFICATION_NOT_NEW_PROGRAMME_EVIDENCE","NO_SUCCESSOR_PROGRAMME_OPERATION_AUTHORIZED","PACKET_PUBLICATION_IDENTITY_REQUIRES_EXTERNAL_ESTABLISHMENT"]}},
"authority_not_granted":{"type":"array","minItems":16,"maxItems":16,"uniqueItems":true,"items":{"enum":["STAGE3_GENERAL_IMPLEMENTATION","STAGE4_IMPLEMENTATION","PROVIDER_SELECTION","SHADOW_TRADING","PAPER_TRADING","CANARY","LIVE_TRADING","BROKER_EXECUTION","OMS_EXECUTION","RISK_APPROVAL","ACCOUNTING_AUTHORITY","LEDGER_AUTHORITY","CAPITAL_ALLOCATION","FINANCIAL_EFFECTS","AI_TRADING_AUTHORITY","SUCCESSOR_PROGRAMME_OPERATION"]}},
"restore_assertions":{"type":"array","minItems":14,"maxItems":14,"uniqueItems":true,"items":{"enum":["VERIFY_CURRENT_STAGE3_BOUNDED_IMPLEMENTATION_STATE","VERIFY_REPOSITORY_IDENTITY","VERIFY_RECOVERY_BASIS_COMMIT_TREE_AND_ORDERED_PARENTS","VERIFY_REQUIRED_SOURCE_PATHS_AND_GIT_BLOBS","VALIDATE_PROGRAMME_CONTROL_STRUCTURE_AND_SEMANTICS","VALIDATE_STAGE3_STRUCTURE_AND_SEMANTICS","VERIFY_M1_AND_STAGE2_CURRENT_STATE","VERIFY_FOUR_GAP_SUMMARY_AND_LIMITATIONS","VERIFY_AUTHORITY_DENIALS","VERIFY_DEFERRED_AND_OPEN_WORK","VERIFY_STALE_SOURCE_EXCLUSIONS","VERIFY_REPRODUCIBLE_ENVIRONMENT_REFERENCES","VERIFY_NO_AUTHORIZED_SUCCESSOR_OPERATION","ESTABLISH_PACKET_PUBLICATION_IDENTITY_EXTERNALLY"]}}
},"$defs":{
"kf04Successor":{"const":{"schema_version":1,"record_id":"ATIS-MASTER-RECOVERY-SUCCESSOR-KF04-001","record_role":"CURRENT_CANDIDATE_INVENTORY_ONLY","amendment_id":"ATIS-S3-GOV-AMD-KF04-001","historical_packet":{"path":"docs/programme/master-recovery-packet.json","git_blob":"ba40f75156e58a08fdd6d97cde3100bf0eefbae3","canonical_sha256":"bd39fd6768ab3fb5608418343858137f759875537e4b9c1f5d956a5451d37e43"},"protected_baseline":{"atis_master":"562e0d633b5b14749d5eb5476d9d8886adc703cf","atis_tree":"d7178f5d84cffc6368b69878f0ff2998fe5a4c5d","trust_main":"f0265c9ce10bac49ff32bb3620a898f263c4791a","policy_main":"af7a95105466649a538734a16919a81705b5ad8f"},"transitions":[{"path":"docs/programme/programme-control.json","historical_blob":"2bb69105bbd2199ce8e114a1aed018216559bf34","candidate_blob":"4e7dbcc3c05f0d6bddf70e22b51fa810b07df626"},{"path":"docs/programme/programme-control.schema.json","historical_blob":"573205a85273424dabbab5fe8720de3a94b7a583","candidate_blob":"40c03dfbcde899c18f0dd1e1edd3ea408bd7c504"},{"path":"tests/test_programme_control.py","historical_blob":"4e42082f53252fee6132ddb67251b1409dceeb4e","candidate_blob":"4f5f8a4fdbff5b83669ab1a28bfed88f0786234f"}],"historical_authority":"PRESERVED_NOT_CURRENT_ACCEPTANCE","owner_acceptance":"PENDING","grants_authority":false}},
"gitId":{"type":"string","pattern":"^[0-9a-f]{40}$"},"path":{"type":"string","minLength":1,"pattern":"^(?!/)(?!.*\\\\)[^\\u0000]+$"},
"requiredSource":{"type":"object","additionalProperties":false,"required":["path","git_blob","classification","required_for"],"properties":{"path":{"$ref":"#/$defs/path"},"git_blob":{"$ref":"#/$defs/gitId"},"classification":{"const":"REQUIRED"},"required_for":{"type":"array","minItems":1,"uniqueItems":true,"items":{"enum":["REPRODUCIBLE_ENVIRONMENT","GOVERNING_BASELINE","SOURCE_PROVENANCE","M1_CURRENT_STATE","CURRENT_PROGRAMME_STATE","FOUR_GAP_STATE","AUTHORITY_BOUNDARY","DEFERRED_WORK","PROGRAMME_CONTROL_VALIDATION","STAGE2_CLOSURE","STAGE2_FREEZE","STAGE3_PROTECTED_SPECIFICATION","STAGE3_OPEN_WORK","STAGE3_VALIDATION","RESTORE_PROCEDURE"]}}}},
"supplementarySource":{"type":"object","additionalProperties":false,"required":["path","git_blob","classification"],"properties":{"path":{"$ref":"#/$defs/path"},"git_blob":{"$ref":"#/$defs/gitId"},"classification":{"const":"SUPPLEMENTARY_DEEP_AUDIT"}}},
"historicalSource":{"type":"object","additionalProperties":false,"required":["path","git_blob","classification","current_authority"],"properties":{"path":{"$ref":"#/$defs/path"},"git_blob":{"$ref":"#/$defs/gitId"},"classification":{"const":"HISTORICAL_ONLY"},"current_authority":{"const":false}}},
"gap":{"type":"object","additionalProperties":false,"required":["gap_id","historical_state","classification","verbatim_source_recovered"],"properties":{"gap_id":{"enum":["GAP-REVIEW-5","GAP-FROZEN-VERBATIM","GAP-RESEARCH-DEFINITIONS","GAP-RESEARCH-ORDER"]},"historical_state":{"const":"UNRESOLVED"},"classification":{"enum":["CONFIRMED","RECONSTRUCTED"]},"verbatim_source_recovered":{"type":"boolean"}}},
"currentState":{"type":"object","additionalProperties":false,"required":["m1","stage2","stage3_specification","stage3_implementation","stage4_implementation","provider","trading_or_financial_authority","successor_operation_authorized","four_gap_summary","details_source"],"properties":{"m1":{"const":"PROTECTED"},"stage2":{"const":"CLOSED / AUDITED / FROZEN / PROTECTED"},"stage3_specification":{"const":"PROTECTED"},"stage3_implementation":{"const":"BOUNDED_COMPONENTS_PROTECTED / GENERAL_STAGE3_NOT_CLOSED"},"stage4_implementation":{"const":"NOT_AUTHORIZED"},"provider":{"const":"NONE_SELECTED"},"trading_or_financial_authority":{"const":"NONE"},"successor_operation_authorized":{"const":false},"four_gap_summary":{"type":"array","minItems":4,"maxItems":4,"uniqueItems":true,"items":{"$ref":"#/$defs/gap"}},"details_source":{"const":"docs/programme/programme-control.json"}}},
"exclusion":{"type":"object","additionalProperties":false,"required":["subject","classification","current_authority","reason","current_source"],"properties":{"subject":{"type":"string","minLength":1},"classification":{"enum":["STALE_DO_NOT_USE_AS_CURRENT_AUTHORITY","CREATION_TIME_STATE_ONLY","HISTORICAL_ONLY","NON_PROTECTED_PUBLICATION_BRANCH","DERIVATION_BASELINE_ONLY","NON_GOVERNING_DERIVATIVE","ATTRIBUTABLE_NOT_INDEPENDENTLY_REHASHED"]},"current_authority":{"const":false},"reason":{"type":"string","minLength":1},"current_source":{"type":"string","minLength":1}}}
}}
