{
  "schema_version": 1,
  "packet_id": "ATIS-MASTER-RECOVERY-PACKET-001",
  "packet_role": "RECOVERY_INDEX_ONLY",
  "repository": "KiloAlpha021/automated-trading-bot",
  "non_authorizing_statement": "This packet indexes protected recovery sources and grants no programme, implementation, provider, trading, execution, risk, accounting, ledger, capital, financial or AI authority.",
  "recovery_basis": {
    "commit": "119ab879fd96c64a4f04441da03945b5a22ed03d",
    "tree": "48e59fcc69b91c60d102d8236c0dbfeed64feaf5",
    "ordered_parents": [
      "622790404a9eec25dae3f41fa19f15a5e5319342",
      "e379c329499a35e22911c596e67968fcf875916d"
    ],
    "verification_decision": "ATIS_PR23_FINAL_POST_MERGE_VERIFICATION_PASS",
    "meaning": "RECOVERY_BASIS_NOT_PACKET_PUBLICATION_IDENTITY"
  },
  "reading_precedence": [
    "RECOVERY_BASIS_AND_INDEX",
    "CURRENT_PROGRAMME_CONTROL",
    "CURRENT_MILESTONE_CLOSURE_AND_PROTECTION",
    "PROTECTED_STAGE3_SPECIFICATION",
    "GOVERNING_BASELINE_SPECIFICATION",
    "SUPPLEMENTARY_TRACEABILITY_AND_EVIDENCE",
    "HISTORICAL_OR_SUPERSEDED_EVIDENCE"
  ],
  "required_sources": [
    {
      "path": ".python-version",
      "git_blob": "3b2cfc0e6904f4f3bfefaadc28451ba1f2818332",
      "classification": "REQUIRED",
      "required_for": [
        "REPRODUCIBLE_ENVIRONMENT"
      ]
    },
    {
      "path": "docs/baseline/sources/Automated_Trading_Bot_Implementation_Specification_v1.0_Baseline_and_Build_Decomposition.docx",
      "git_blob": "8e116c3f3a75b0a038d947c8f66c1c57f1a4ff2e",
      "classification": "REQUIRED",
      "required_for": [
        "GOVERNING_BASELINE"
      ]
    },
    {
      "path": "docs/baseline/specification-provenance.json",
      "git_blob": "30ea05b9c395fc1051a7c2d3a25ec7a01fb08179",
      "classification": "REQUIRED",
      "required_for": [
        "GOVERNING_BASELINE",
        "SOURCE_PROVENANCE"
      ]
    },
    {
      "path": "docs/m1-closure/closure-manifest.json",
      "git_blob": "9c653dc2183700c86191e8f14bfd4db020f38a5b",
      "classification": "REQUIRED",
      "required_for": [
        "M1_CURRENT_STATE"
      ]
    },
    {
      "path": "docs/programme/programme-control.json",
      "git_blob": "c4ec2db3600ab5aaaced785399ca680580069708",
      "classification": "REQUIRED",
      "required_for": [
        "CURRENT_PROGRAMME_STATE",
        "FOUR_GAP_STATE",
        "AUTHORITY_BOUNDARY",
        "DEFERRED_WORK"
      ]
    },
    {
      "path": "docs/programme/programme-control.schema.json",
      "git_blob": "573205a85273424dabbab5fe8720de3a94b7a583",
      "classification": "REQUIRED",
      "required_for": [
        "PROGRAMME_CONTROL_VALIDATION"
      ]
    },
    {
      "path": "docs/stage2/gate-s02-01.json",
      "git_blob": "850ce45a88d30b9348686493355fb681a464759f",
      "classification": "REQUIRED",
      "required_for": [
        "STAGE2_CLOSURE"
      ]
    },
    {
      "path": "docs/stage2/stage2-freeze-record.json",
      "git_blob": "5a4425eeb79c87072e8c498981c55565c386c677",
      "classification": "REQUIRED",
      "required_for": [
        "STAGE2_FREEZE",
        "DEFERRED_WORK"
      ]
    },
    {
      "path": "docs/stage3/stage3-specification.json",
      "git_blob": "15a51e0349c3e983e0da86d928a383dc25ed1cf4",
      "classification": "REQUIRED",
      "required_for": [
        "STAGE3_PROTECTED_SPECIFICATION",
        "STAGE3_OPEN_WORK",
        "AUTHORITY_BOUNDARY"
      ]
    },
    {
      "path": "docs/stage3/stage3-specification.schema.json",
      "git_blob": "a68f3aba5bff62beabe11bb14328d37a99165380",
      "classification": "REQUIRED",
      "required_for": [
        "STAGE3_VALIDATION"
      ]
    },
    {
      "path": "pyproject.toml",
      "git_blob": "f7cf0df47ffc4e1309803b48dc26114851dfb0ee",
      "classification": "REQUIRED",
      "required_for": [
        "REPRODUCIBLE_ENVIRONMENT"
      ]
    },
    {
      "path": "requirements-dev.lock",
      "git_blob": "cfb3245eef00c6f51e619aa15a5432dfc8893d89",
      "classification": "REQUIRED",
      "required_for": [
        "REPRODUCIBLE_ENVIRONMENT"
      ]
    },
    {
      "path": "scripts/bootstrap.ps1",
      "git_blob": "78c82833f387ce94f786f58f93947917076fd61a",
      "classification": "REQUIRED",
      "required_for": [
        "RESTORE_PROCEDURE",
        "REPRODUCIBLE_ENVIRONMENT"
      ]
    },
    {
      "path": "tests/test_programme_control.py",
      "git_blob": "d74e1981f8ce3ecf953b2a2f19ed0d02947150a2",
      "classification": "REQUIRED",
      "required_for": [
        "PROGRAMME_CONTROL_VALIDATION",
        "FOUR_GAP_STATE",
        "AUTHORITY_BOUNDARY"
      ]
    },
    {
      "path": "tests/test_stage3_specification.py",
      "git_blob": "7cb5fa5d266f9e06f18190e4d1a55b1014c36884",
      "classification": "REQUIRED",
      "required_for": [
        "STAGE3_VALIDATION"
      ]
    }
  ],
  "supplementary_sources": [
    {
      "path": "docs/baseline/sources/Automated_Trading_Bot_Implementation_Specification_v1.0.txt",
      "git_blob": "f0e4f657069facdda9741411a9566c9fe6b36fa9",
      "classification": "SUPPLEMENTARY_DEEP_AUDIT"
    },
    {
      "path": "docs/m1-closure/stage0b-phase39-67-coverage.json",
      "git_blob": "8652bffe48add6cb6b8e63d64e9b2647b48e1739",
      "classification": "SUPPLEMENTARY_DEEP_AUDIT"
    },
    {
      "path": "docs/m1-closure/traceability.json",
      "git_blob": "4261e1ab17f1d839f07f1a355340f54f0d8beb8c",
      "classification": "SUPPLEMENTARY_DEEP_AUDIT"
    },
    {
      "path": "docs/stage2/s27-evidence.json",
      "git_blob": "ae1dbcca0c19b13a634ed6c503b975a40a9b4bc8",
      "classification": "SUPPLEMENTARY_DEEP_AUDIT"
    },
    {
      "path": "docs/programme/successor-evidence.json",
      "git_blob": "af6af201dcac63d420a046fcbc2622348f56776e",
      "classification": "SUPPLEMENTARY_DEEP_AUDIT"
    }
  ],
  "historical_sources": [
    {
      "path": "docs/m1-closure/closure-manifest-historical-2026-09-12.json",
      "git_blob": "50bc7b5074d848563c062de0514bfcc6899297bb",
      "classification": "HISTORICAL_ONLY",
      "current_authority": false
    },
    {
      "path": "docs/m1-closure/closure-manifest-reclosed-2026-09-12.json",
      "git_blob": "d4855333a52b691b6a4fdd70109fe0f67e1c3dcf",
      "classification": "HISTORICAL_ONLY",
      "current_authority": false
    },
    {
      "path": "docs/m1-closure/closure-manifest-reopened-2026-09-13.json",
      "git_blob": "4d57ba3a8a3c90e128ff1c3e6fe23bfb95a4fbdc",
      "classification": "HISTORICAL_ONLY",
      "current_authority": false
    }
  ],
  "current_state": {
    "m1": "PROTECTED",
    "stage2": "CLOSED / AUDITED / FROZEN / PROTECTED",
    "stage3_specification": "PROTECTED",
    "stage3_implementation": "BOUNDED_COMPONENTS_PROTECTED / GENERAL_STAGE3_NOT_CLOSED",
    "stage4_implementation": "NOT_AUTHORIZED",
    "provider": "NONE_SELECTED",
    "trading_or_financial_authority": "NONE",
    "successor_operation_authorized": false,
    "four_gap_summary": [
      {
        "gap_id": "GAP-REVIEW-5",
        "historical_state": "UNRESOLVED",
        "classification": "CONFIRMED",
        "verbatim_source_recovered": true
      },
      {
        "gap_id": "GAP-FROZEN-VERBATIM",
        "historical_state": "UNRESOLVED",
        "classification": "CONFIRMED",
        "verbatim_source_recovered": true
      },
      {
        "gap_id": "GAP-RESEARCH-DEFINITIONS",
        "historical_state": "UNRESOLVED",
        "classification": "RECONSTRUCTED",
        "verbatim_source_recovered": false
      },
      {
        "gap_id": "GAP-RESEARCH-ORDER",
        "historical_state": "UNRESOLVED",
        "classification": "RECONSTRUCTED",
        "verbatim_source_recovered": false
      }
    ],
    "details_source": "docs/programme/programme-control.json"
  },
  "stale_source_exclusions": [
    {
      "subject": "HISTORICAL_M1_CLOSURE_MANIFESTS",
      "classification": "STALE_DO_NOT_USE_AS_CURRENT_AUTHORITY",
      "current_authority": false,
      "reason": "Predecessor closure and reopening records cannot replace current M1 closure.",
      "current_source": "docs/m1-closure/closure-manifest.json"
    },
    {
      "subject": "STAGE2_GATE_NOT_YET_FROZEN_FIELDS",
      "classification": "CREATION_TIME_STATE_ONLY",
      "current_authority": false,
      "reason": "NOT_YET_FROZEN records gate creation time, not current Stage-2 state.",
      "current_source": "docs/programme/programme-control.json"
    },
    {
      "subject": "STAGE2_FREEZE_CANDIDATE_WORDING",
      "classification": "CREATION_TIME_STATE_ONLY",
      "current_authority": false,
      "reason": "Candidate wording records freeze-document creation time.",
      "current_source": "docs/programme/programme-control.json"
    },
    {
      "subject": "STAGE3_EMBEDDED_HISTORICAL_ANSWERS",
      "classification": "HISTORICAL_ONLY",
      "current_authority": false,
      "reason": "Embedded answers cannot override final corpus state and authority sections.",
      "current_source": "docs/stage3/stage3-specification.json"
    },
    {
      "subject": "README_CANONICAL_DOCUMENT_ABSENCE_CLAIM",
      "classification": "STALE_DO_NOT_USE_AS_CURRENT_AUTHORITY",
      "current_authority": false,
      "reason": "Canonical documents are now present.",
      "current_source": "docs/baseline/specification-provenance.json"
    },
    {
      "subject": "PC_HOUSEKEEPING_001_FEATURE_BRANCH",
      "classification": "NON_PROTECTED_PUBLICATION_BRANCH",
      "current_authority": false,
      "reason": "The retained feature branch is not protected master.",
      "current_source": "RECOVERY_BASIS_AND_INDEX"
    },
    {
      "subject": "PROGRAMME_CONTROL_SOURCE_BASELINE",
      "classification": "DERIVATION_BASELINE_ONLY",
      "current_authority": false,
      "reason": "source_baseline is a construction baseline, not current protected master.",
      "current_source": "RECOVERY_BASIS_AND_INDEX"
    },
    {
      "subject": "STAGE3_INTERNAL_BASELINE",